bb61463a-0024-4594-8c00-45f9b013f396,"Church-Lady Charlotte","Church-Lady Charlotte","Life revolves around church. Teaches Sunday School, sings in choir, leads women's ministry. Faith drives her to care about others' suffering. Sees helping plaintiff as religious duty. 'What would Jesus do?' answer is always: help the suffering.","The Bible says to care for the least of these. We have a duty here.",HEART_03,heart,1,,,2,system,,"Faith-driven compassion. Sees justice as religious obligation.",65,female,Black,"Birmingham, AL (urban)","High school","Retired School Cafeteria Worker",26000,"Married 45 years, 4 kids, 9 grandkids","Baptist (very devout - teaches Sunday School)","Democrat",,,,,,,,,,,,,,"The Bible says to care for the least of these; We're called to do justice; That poor soul has suffered so much; How would Jesus judge this situation?; Lord, help us do the right thing",,,,"Will advocate for plaintiff from emotional connection. Will push for high non-economic damages. May become visibly emotional during deliberation. Will humanize plaintiff's story and resist cold calculation.",,,,,,,,"STRONG PLAINTIFF","This person has suffered. Their pain is real. They deserve compassion and compensation. Money can't fix everything, but it can help.","Helping profession (nursing, counseling, teaching, ministry); Emotional language and visible reactions to suffering; References to family, children, 'putting yourself in their shoes'; Strong religious faith emphasizing compassion; Phrases like 'I can only imagine' or 'think about their family'",0.75,"High. Helping is a religious duty.","Moral voice. Religious authority carries weight.","KEEP. Her faith compels compassion.","STRIKE. Hard to argue against 'What would Jesus do?'",1,4,,,,,,,,,,2,"Education Professional(POSITIVE:0.80); Age 51+(POSITIVE:0.70)",true,2026-01-28T14:05:25.006Z,2026-01-29T16:46:29.485Z
dc894f87-3116-47d7-89fd-44beda57e862,"Feel-Your-Pain Pam","Feel-Your-Pain Pam","Master's in counseling, works with traumatized children daily. Professional training in empathy. Sees impact of harm on families every day. Can't NOT feel the plaintiff's pain. Will become emotional advocate.","Think about what this person has been through. There's a human being behind these numbers.",HEART_01,heart,1,,,2,system,,"Professional empath. Will connect with plaintiff's suffering immediately.",36,female,Latina,"San Antonio, TX (suburban)","Master's - Counseling Psychology","School Counselor",58000,"Married, 2 young kids","Catholic","Democrat",,,,,,,,,,,,,,"Think about what this person has been through; There's a human being behind these numbers; I can only imagine the pain; Put yourself in their shoes; How would you feel if this happened to your family?",,,,"Will advocate for plaintiff from emotional connection. Will push for high non-economic damages. May become visibly emotional during deliberation. Will humanize plaintiff's story and resist cold calculation.",,,,,,,,"STRONG PLAINTIFF","This person has suffered. Their pain is real. They deserve compassion and compensation. Money can't fix everything, but it can help.","Helping profession (nursing, counseling, teaching, ministry); Emotional language and visible reactions to suffering; References to family, children, 'putting yourself in their shoes'; Strong religious faith emphasizing compassion; Phrases like 'I can only imagine' or 'think about their family'",0.75,"High. Pain is real and deserves compensation.","Emotional advocate. Will humanize plaintiff.","KEEP. Will fight for damages.","STRIKE. She's already emotionally connected to plaintiff.",1,4,,,,,,,,,,3,"Education Professional(POSITIVE:0.80); Advanced Degree(POSITIVE:0.80); Age 31-50(POSITIVE:0.70)",true,2026-01-28T14:05:25.003Z,2026-01-29T16:46:29.484Z
ef30962e-2a63-4c20-84d1-824c8cc128e6,"Seen-Real-Suffering Susan","Seen-Real-Suffering Susan","30 years as oncology nurse watching patients suffer and die. Lost her own husband to cancer. Knows pain is real from bedside experience. Can translate medical concepts AND humanize them. Credibility from profession plus empathy from experience.","I've held hands with dying patients. I know what pain looks like.",HEART_05,heart,1,,,2,system,,"Medical professional who has witnessed real suffering. Credible AND empathetic.",55,female,white,"Boston, MA (suburban)","Bachelor's - Nursing","Oncology Nurse",78000,"Widowed, 3 adult kids","Catholic","Democrat",,,,,,,,,,,,,,"I've held hands with people who are dying; I know what suffering looks like; Pain is real even if you can't measure it; In 30 years of nursing, I've seen...; The medical bills are just the beginning",,,,"Will advocate for plaintiff from emotional connection. Will push for high non-economic damages. May become visibly emotional during deliberation. Will humanize plaintiff's story and resist cold calculation.",,,,,,,,"STRONG PLAINTIFF","This person has suffered. Their pain is real. They deserve compassion and compensation. Money can't fix everything, but it can help.","Helping profession (nursing, counseling, teaching, ministry); Emotional language and visible reactions to suffering; References to family, children, 'putting yourself in their shoes'; Strong religious faith emphasizing compassion; Phrases like 'I can only imagine' or 'think about their family'",0.7,"High, well-reasoned. Understands true cost of injury.","Medical credibility + emotional impact. Very influential.","KEEP. Combines credibility with compassion.","STRIKE. She'll educate the jury about real suffering.",1,4,,,,,,,,,,3,"Healthcare Professional(POSITIVE:0.80); Bachelor's Degree(POSITIVE:0.70); Age 51+(POSITIVE:0.70)",true,2026-01-28T14:05:25.011Z,2026-01-29T16:46:29.486Z
28d908d3-a933-45bf-a11c-15dfbde8ee65,"Think-Of-The-Children Tina","Think-Of-The-Children Tina","Young mother of two small children. Strong maternal empathy. Will immediately think 'what if this was my family?' Especially powerful in cases involving children, but will project maternal feelings onto almost any plaintiff.","I keep thinking about my own kids. What if this happened to them?",HEART_04,heart,1,,,2,system,,"Young mother. Will project her children onto any case involving kids or families.",28,female,Black,"Charlotte, NC (suburban)","Bachelor's - Elementary Education","Elementary School Teacher",45000,"Married, 2 young kids (3 and 5)","Baptist","Democrat",,,,,,,,,,,,,,"I think about my own children; What if this happened to my family?; Those poor kids; As a mother, I can't imagine...; That child will never be the same",,,,"Will advocate for plaintiff from emotional connection. Will push for high non-economic damages. May become visibly emotional during deliberation. Will humanize plaintiff's story and resist cold calculation.",,,,,,,,"STRONG PLAINTIFF","This person has suffered. Their pain is real. They deserve compassion and compensation. Money can't fix everything, but it can help.","Helping profession (nursing, counseling, teaching, ministry); Emotional language and visible reactions to suffering; References to family, children, 'putting yourself in their shoes'; Strong religious faith emphasizing compassion; Phrases like 'I can only imagine' or 'think about their family'",0.7,"High, especially in cases involving children.","Maternal perspective. Powerful in family impact cases.","KEEP. Especially powerful if your case involves family impact.","STRIKE in cases involving children or family impact.",1,4,,,,,,,,,,3,"Education Professional(POSITIVE:0.80); Bachelor's Degree(POSITIVE:0.70); Age 18-30(POSITIVE:0.70)",true,2026-01-28T14:05:25.008Z,2026-01-29T16:46:29.443Z
bbe48028-da0b-4535-b00e-f26f79bb9a2b,"Don't-Tread-On-Me Dan","Don't-Tread-On-Me Dan","Third-generation Montana rancher. Deeply distrusts government. Has fought with federal agencies over land use and regulations. Libertarian political philosophy. May refuse to apply laws he views as unconstitutional overreach. Unpredictable.","The government has no right to tell me how to judge. Regulations are tyranny.",MAVE_02,maverick,1,,,2,system,,"Anti-government libertarian. May refuse to enforce regulations he views as illegitimate.",52,male,white,"Rural Montana","Some college","Cattle Rancher",65000,"Married 25 years, 3 kids","Non-denominational","Libertarian",,,,,,,,,,,,,,"The government has no right to tell people how to run their business; Where does it say in the Constitution...; This is just lawyers making money; Another government regulation that doesn't make sense; I don't trust the government to tell me what's right",,,,"May refuse to follow jury instructions. Will decide based on personal moral framework, not evidence or law. Can cause hung jury. Nearly impossible to persuade. May announce they won't participate in 'unjust' verdict.",,,,,,,,"UNPREDICTABLE","I answer to a higher authority than the judge. My conscience / God / principles come first. If the law is unjust, I won't enforce it.","Hesitation when asked if they can follow judge's instructions; Statements about conscience, God, or principles over law; History of civil disobedience or extreme activism; Extreme positions on either political end; References to 'jury nullification' or 'citizen's duty'",,,"May refuse to enforce regulations. Unpredictable.","STRIKE if case involves regulatory violations. Unpredictable otherwise.","MAYBE KEEP if plaintiff's case relies on regulation violations. STRIKE if unpredictable.",,,,,,,,,,,,1,"Age 51+(POSITIVE:0.70)",true,2026-01-28T14:05:40.914Z,2026-01-29T16:46:29.543Z
68ab9fa7-dc30-420d-bda1-e9a5b1500b54,"Higher-Law Harold","Higher-Law Harold","Grew up during Jim Crow, participated in civil rights movement. Has seen unjust laws and defied them. 40 years as pastor. Explicitly endorses jury nullification. Believes jurors should follow conscience, not just law. Taught that law isn't always right.","There's a higher law than what's written in statute books. I've seen unjust laws before.",MAVE_01,maverick,1,,,2,system,,"Civil rights background. Will follow conscience over instructions if they conflict.",67,male,Black,"Birmingham, AL (urban)","Master of Divinity","Retired Pastor",42000,"Married 44 years, 4 kids","Baptist (clergy)","Democrat",,,,,,,,,,,,,,"The law isn't always just; There's a higher law than what's written in books; I've seen unjust laws before; I answer to God before any judge; Justice requires more than following instructions",,,,"May refuse to follow jury instructions. Will decide based on personal moral framework, not evidence or law. Can cause hung jury. Nearly impossible to persuade. May announce they won't participate in 'unjust' verdict.",,,,,,,,"UNPREDICTABLE","I answer to a higher authority than the judge. My conscience / God / principles come first. If the law is unjust, I won't enforce it.","Hesitation when asked if they can follow judge's instructions; Statements about conscience, God, or principles over law; History of civil disobedience or extreme activism; Extreme positions on either political end; References to 'jury nullification' or 'citizen's duty'",,,"May announce he'll vote his conscience regardless of law.","RISKY. May help, may cause hung jury. His statements likely support cause challenge anyway.","CHALLENGE FOR CAUSE. His statements admit inability to follow instructions.",,,,,,,,,,,,2,"Advanced Degree(POSITIVE:0.80); Age 51+(POSITIVE:0.70)",true,2026-01-28T14:05:40.913Z,2026-01-29T16:46:29.542Z
64fd0f2d-f72f-4684-b0df-ebf353380eec,"System-Is-Rigged Rhonda","System-Is-Rigged Rhonda","Sociology degree focused on systemic racism. Community organizer for 10 years. Active in BLM movement. Views legal system as fundamentally racist. Believes in using any tool to achieve racial justice. May prioritize justice over legal technicalities.","The legal system has never been fair to people like me. I won't help perpetuate injustice.",MAVE_03,maverick,1,,,2,system,,"Racial justice activist. May nullify to achieve what she sees as justice.",34,female,Black,"Oakland, CA (urban)","Bachelor's - Sociology, African American Studies","Community Organizer",48000,"Single, no kids","Spiritual","Democrat (activist)",,,,,,,,,,,,,,"The system has never been fair to people who look like me; We need to talk about the racial dynamics here; This is about more than just this case; I'm not going to participate in an unjust system; Justice means something different when you've been oppressed",,,,"May refuse to follow jury instructions. Will decide based on personal moral framework, not evidence or law. Can cause hung jury. Nearly impossible to persuade. May announce they won't participate in 'unjust' verdict.",,,,,,,,"UNPREDICTABLE","I answer to a higher authority than the judge. My conscience / God / principles come first. If the law is unjust, I won't enforce it.","Hesitation when asked if they can follow judge's instructions; Statements about conscience, God, or principles over law; History of civil disobedience or extreme activism; Extreme positions on either political end; References to 'jury nullification' or 'citizen's duty'",,,"Will introduce systemic justice framing. May refuse 'unjust' verdict.","RISKY. Pro-plaintiff but unpredictable. May cause hung jury.","STRIKE. Will view corporate defendant through systemic racism lens.",,,,,,,,,,,,2,"Bachelor's Degree(POSITIVE:0.70); Age 31-50(POSITIVE:0.70)",true,2026-01-28T14:05:40.915Z,2026-01-29T16:46:29.545Z
df750552-717d-4e88-b6a2-bc4458925d49,"Won't-Award-A-Dime Walt","Won't-Award-A-Dime Walt","Owned manufacturing business for 35 years. Sued multiple times, considers all frivolous. Active in tort reform advocacy. Believes lawsuits are fundamentally illegitimate form of legalized extortion. May refuse to find for ANY plaintiff on principle.","Lawsuits are destroying this country. I won't give a penny to a plaintiff, period.",MAVE_04,maverick,1,,,2,system,,"Anti-lawsuit absolutist. Will refuse to find for any plaintiff on principle.",70,male,white,"Tucson, AZ (suburban)","Bachelor's - Business","Retired Business Owner",85000,"Married 45 years, 3 kids","Catholic","Republican (tort reform activist)",,,,,,,,,,,,,,"Lawsuits are destroying this country; I won't be part of this lawsuit lottery; Trial lawyers are parasites; No matter what the evidence shows, I can't support this; These cases shouldn't even go to trial",,,,"May refuse to follow jury instructions. Will decide based on personal moral framework, not evidence or law. Can cause hung jury. Nearly impossible to persuade. May announce they won't participate in 'unjust' verdict.",,,,,,,,"UNPREDICTABLE","I answer to a higher authority than the judge. My conscience / God / principles come first. If the law is unjust, I won't enforce it.","Hesitation when asked if they can follow judge's instructions; Statements about conscience, God, or principles over law; History of civil disobedience or extreme activism; Extreme positions on either political end; References to 'jury nullification' or 'citizen's duty'",,,"Will announce refusal to vote for plaintiff. Will cause hung jury.","CHALLENGE FOR CAUSE. His statements explicitly admit he cannot be fair.","His statements make him challengeable. Don't expect to keep him.",,,,,,,,,,,,3,"Business Professional(POSITIVE:0.80); Bachelor's Degree(POSITIVE:0.70); Age 51+(POSITIVE:0.70)",true,2026-01-28T14:05:40.916Z,2026-01-29T16:46:29.546Z
5c84f2c5-fe11-45f3-a360-0b9d1bc151cb,"Auditor Adam","Auditor Adam","Nigerian immigrant, first generation. Career as auditor requires objective evaluation. Has uncovered corporate fraud AND frivolous claims. Trusts documentation over testimony. Professional training in skepticism applies to both sides equally.","I've seen corporate fraud AND exaggerated claims. The documents tell the truth.",SCALE_05,scale_balancer,1,,,2,system,,"Financial professional. Trusts documentation, skeptical of everyone.",38,male,Black,"Minneapolis, MN (suburban)","Master's - Accounting + CPA","Senior Auditor",115000,"Married, 2 kids","Catholic","Independent",,,,,,,,,,,,,,"I need to see the documentation; In my experience auditing companies...; The numbers tell a story; Let's verify that claim; I've seen misconduct and I've seen exaggeration",,,,"Will ask clarifying questions. Will weigh arguments from both sides. Can be persuaded by strong evidence. Often helps build consensus. Won't give sympathy verdicts but won't dismiss legitimate claims either.",,,,,,,,"NEUTRAL","Every case should be decided on its own merits. Both plaintiffs and defendants can be right or wrong. I'll wait to hear the evidence before forming an opinion.","Balanced answers acknowledging both perspectives; Phrases like 'I'd need to see the evidence' or 'it depends'; Moderate or Independent politics; Professions requiring objectivity (HR, auditing, research, mediation); Thoughtful, measured speaking style",0.5,"Based on documented evidence. Skeptical of unsupported numbers.","Document analyst. Will focus on paper trail.","KEEP if you have strong documentation.","KEEP if plaintiff's documents are weak.",3,3,,,,,,,,,,2,"Advanced Degree(POSITIVE:0.80); Age 31-50(POSITIVE:0.70)",true,2026-01-28T14:05:24.980Z,2026-01-29T16:46:29.482Z
062cc98d-152e-4b48-b709-584123826f31,"HR-Director Denise","HR-Director Denise","20 years mediating workplace disputes. Knows there are usually two sides to every story. Professional training in finding common ground. Naturally empathetic but professionally balanced. Will try to build consensus rather than take sides.","I've mediated hundreds of disputes. There's usually truth on both sides.",SCALE_04,scale_balancer,1,,,2,system,,"Professional mediator. Natural consensus builder.",49,female,Latina,"Albuquerque, NM (suburban)","Bachelor's - Psychology + HR certifications","HR Director",95000,"Married, 3 kids","Catholic","Democrat (moderate)",,,,,,,,,,,,,,"I've mediated hundreds of disputes; Usually both sides have legitimate points; Let's try to understand everyone's perspective; What would be fair to both parties?; Let me see if I can summarize where we agree",,,,"Will ask clarifying questions. Will weigh arguments from both sides. Can be persuaded by strong evidence. Often helps build consensus. Won't give sympathy verdicts but won't dismiss legitimate claims either.",,,,,,,,"NEUTRAL","Every case should be decided on its own merits. Both plaintiffs and defendants can be right or wrong. I'll wait to hear the evidence before forming an opinion.","Balanced answers acknowledging both perspectives; Phrases like 'I'd need to see the evidence' or 'it depends'; Moderate or Independent politics; Professions requiring objectivity (HR, auditing, research, mediation); Thoughtful, measured speaking style",0.5,"Compromise-oriented. Will seek middle ground.","Natural facilitator. May emerge as unofficial leader.","KEEP. Fair and can help build consensus for you.","KEEP. Fair and won't let emotions run away.",3,3,,,,,,,,,,2,"Bachelor's Degree(POSITIVE:0.70); Age 31-50(POSITIVE:0.70)",true,2026-01-28T14:05:24.978Z,2026-01-29T16:46:29.518Z
25ec9611-c2d3-4072-b6df-16f72a03d506,"Just-The-Facts Fiona","Just-The-Facts Fiona","Engineering and business background. Career requires data-driven decisions. No strong political ideology. Prides herself on objectivity. Will analyze case like a business problem - systematically and without preconceptions.","What does the evidence actually show? Let's look at this objectively.",SCALE_01,scale_balancer,1,,,2,system,,"Data-driven professional. Will analyze, not emote.",47,female,Asian (Chinese-American),"San Jose, CA (suburban)","MS Engineering + MBA","Product Manager, Tech",185000,"Married, 2 kids","Buddhist (cultural)","Independent",,,,,,,,,,,,,,"What does the evidence actually show?; I'd need to see the data for that; I can see both sides of this; Let's be systematic about this; That's an interesting point, but what's the proof?",,,,"Will ask clarifying questions. Will weigh arguments from both sides. Can be persuaded by strong evidence. Often helps build consensus. Won't give sympathy verdicts but won't dismiss legitimate claims either.",,,,,,,,"NEUTRAL","Every case should be decided on its own merits. Both plaintiffs and defendants can be right or wrong. I'll wait to hear the evidence before forming an opinion.","Balanced answers acknowledging both perspectives; Phrases like 'I'd need to see the evidence' or 'it depends'; Moderate or Independent politics; Professions requiring objectivity (HR, auditing, research, mediation); Thoughtful, measured speaking style",0.5,"Evidence-based. Will calculate, not guess.","Voice of reason. Will push for fact-based discussion.","KEEP if you have strong evidence. She'll see it.","KEEP if plaintiff's case is weak. She won't give sympathy verdicts.",3,3,,,,,,,,,,3,"Technology Professional(POSITIVE:0.80); Business Professional(POSITIVE:0.80); Age 31-50(POSITIVE:0.70)",true,2026-01-28T14:05:24.974Z,2026-01-29T16:46:29.479Z
c4a12cc3-96be-482f-843e-634fd5b35e6a,"Librarian Linda","Librarian Linda","35 years helping people find accurate information. Trained in information literacy and source verification. Naturally skeptical of claims without evidence. No axe to grind. Values fairness and accuracy above all. Has slight liberal lean but genuinely tries to be fair.","What's the source for that claim? Let's verify before we decide.",SCALE_03,scale_balancer,1,,,2,system,,"Information professional. Values accuracy and source verification.",62,female,white,"Denver, CO (suburban)","MLS - Library Science","Retired Public Librarian",48000,"Widowed, 2 adult kids","Unitarian","Independent (lean liberal)",,,,,,,,,,,,,,"What's the source for that?; I'd like to look at this more carefully; Let's consider all the evidence; Both sides have made some good points; I want to make sure we're being fair",,,,"Will ask clarifying questions. Will weigh arguments from both sides. Can be persuaded by strong evidence. Often helps build consensus. Won't give sympathy verdicts but won't dismiss legitimate claims either.",,,,,,,,"NEUTRAL","Every case should be decided on its own merits. Both plaintiffs and defendants can be right or wrong. I'll wait to hear the evidence before forming an opinion.","Balanced answers acknowledging both perspectives; Phrases like 'I'd need to see the evidence' or 'it depends'; Moderate or Independent politics; Professions requiring objectivity (HR, auditing, research, mediation); Thoughtful, measured speaking style",0.5,"Carefully reasoned. Will research jury award norms if allowed.","Fact-checker. Will question unsupported claims from either side.","KEEP. Nearly perfect Scale-Balancer.","KEEP. She won't be swayed by emotion.",3,3,,,,,,,,,,1,"Age 51+(POSITIVE:0.70)",true,2026-01-28T14:05:24.976Z,2026-01-29T16:46:29.481Z
27692ca6-81c9-484d-8167-a36b2400a4fd,"Moderate Mike","Moderate Mike","Has voted for both parties over the years. Dislikes political extremes on both sides. Career in banking taught him to evaluate loan applications on their merits. Applies same approach to everything. Genuinely doesn't have preconceptions about lawsuits or corporations.","I vote for the person, not the party. I'll judge this case on its merits.",SCALE_02,scale_balancer,1,,,2,system,,"Political centrist. No team loyalty. Truly open-minded.",52,male,white,"Columbus, OH (suburban)","Bachelor's - Business","Bank Branch Manager",85000,"Married, 3 kids","Methodist","Independent (true swing voter)",,,,,,,,,,,,,,"I vote for the person, not the party; I don't like extremes on either side; Let's look at this case specifically; Both sides have made some good points; I'd want to understand both perspectives",,,,"Will ask clarifying questions. Will weigh arguments from both sides. Can be persuaded by strong evidence. Often helps build consensus. Won't give sympathy verdicts but won't dismiss legitimate claims either.",,,,,,,,"NEUTRAL","Every case should be decided on its own merits. Both plaintiffs and defendants can be right or wrong. I'll wait to hear the evidence before forming an opinion.","Balanced answers acknowledging both perspectives; Phrases like 'I'd need to see the evidence' or 'it depends'; Moderate or Independent politics; Professions requiring objectivity (HR, auditing, research, mediation); Thoughtful, measured speaking style",0.5,"Fair. Will try to be reasonable.","Mediating voice. Can bridge divided factions.","KEEP. No bias to overcome.","KEEP. No bias to overcome.",3,3,,,,,,,,,,3,"Business Professional(POSITIVE:0.80); Bachelor's Degree(POSITIVE:0.70); Age 51+(POSITIVE:0.70)",true,2026-01-28T14:05:24.975Z,2026-01-29T16:46:29.498Z
