90086bef-f211-4452-98b6-5b23c7c67b25,"Activist-Teacher Tanya","Activist-Teacher Tanya","10 years teaching in underfunded public schools. Sees daily how systems fail vulnerable kids. Active in teachers' union and social justice causes. Has participated in protests. Believes in accountability and systemic change. Represents urban South progressive.","I see every day how the system fails kids. Somebody needs to be held accountable.",CRUS_08,crusader,1,,,2,system,,"Public school teacher. Sees systemic failures daily. Activist mindset.",35,female,Black,"Atlanta, GA (urban)","Master's - Education","Public High School Teacher",56000,"Single, no kids","AME","Democrat (progressive)",,,,,,,,,,,,,,"The system isn't broken - it's working exactly as designed; My students don't get the same chances; Corporations profit while communities suffer; Accountability is the only thing that creates change; When the powerful hurt the powerless...",,,,"Will advocate for plaintiff from the start. Will push for maximum damages including punitives. Will frame case as justice issue, not just about this plaintiff. May clash with Bootstrappers.",,,,,,,,"STRONG PLAINTIFF","Corporations have too much power and routinely harm regular people. The legal system is one of few ways to hold them accountable. Large verdicts send a message and force change.","Skepticism of corporations, 'the system,' or 'big business'; Union membership or labor/activist background; Social work, nonprofit, education, or advocacy career; Progressive politics, college educated in social sciences; Phrases like 'accountability,' 'power imbalance,' 'pattern of behavior'",0.85,"High including punitives.","Articulate advocate. Can connect with other jurors.","KEEP. Educated, articulate, committed to accountability.","MUST STRIKE. She's already framed your client as the villain.",1,5,,,,,,,,,,3,"Education Professional(POSITIVE:0.80); Advanced Degree(POSITIVE:0.80); Age 31-50(POSITIVE:0.70)",true,2026-01-28T14:05:24.968Z,2026-01-29T16:46:29.435Z
906aaea8-d6a3-461f-8e96-0b4fd2761fd7,"Bernie-Bro Brad","Bernie-Bro Brad","College-educated but underemployed with student loans. Radicalized by 2008 financial crisis and Occupy movement. Believes system is fundamentally rigged for corporations and the wealthy. Active in local organizing. Sees jury duty as chance to deliver justice corporations usually escape.","The billionaires and corporations have rigged everything. Time for them to pay.",CRUS_04,crusader,1,,,2,system,,"Young progressive. Anti-corporate populist. Wants maximum damages.",28,male,white,"Portland, OR (urban)","Bachelor's - Political Science","Barista / Part-time organizer",32000,"Single, no kids","None","Democrat (Sanders supporter)",,,,,,,,,,,,,,"Corporations never pay for what they do; This is our chance to actually hold them accountable; They calculated that it was cheaper to hurt people than fix the problem; The system protects the wealthy; Finally someone has to answer for this",,,,"Will advocate for plaintiff from the start. Will push for maximum damages including punitives. Will frame case as justice issue, not just about this plaintiff. May clash with Bootstrappers.",,,,,,,,"STRONG PLAINTIFF","Corporations have too much power and routinely harm regular people. The legal system is one of few ways to hold them accountable. Large verdicts send a message and force change.","Skepticism of corporations, 'the system,' or 'big business'; Union membership or labor/activist background; Social work, nonprofit, education, or advocacy career; Progressive politics, college educated in social sciences; Phrases like 'accountability,' 'power imbalance,' 'pattern of behavior'",0.9,"Maximum possible. Wants to 'make them pay.'","Passionate advocate. May be too aggressive for some jurors.","KEEP with caution. Passionate but may alienate moderate jurors.","MUST STRIKE. He wants to punish your client.",1,5,,,,,,,,,,2,"Bachelor's Degree(POSITIVE:0.70); Age 18-30(POSITIVE:0.70)",true,2026-01-28T14:05:24.961Z,2026-01-29T16:46:29.497Z
4b7540af-b421-466c-bbae-73fce5d3dfaa,"Knows-The-Coverups Karen","Knows-The-Coverups Karen","25 years as ICU nurse. Also serves as union representative. Has seen hospitals cover up mistakes, change documentation, blame nurses for systemic failures, and pressure staff to stay quiet. Insider knowledge makes her extremely credible AND extremely dangerous for medical defendants.","I'm a nurse. I've seen hospitals change charts after bad outcomes.",CRUS_05,crusader,1,,,2,system,,"Medical insider who knows how the system really works. Devastating in med mal cases.",48,female,Black,"Baltimore, MD (urban)","Bachelor's - Nursing","ICU Nurse / Union Rep",78000,"Divorced, 2 adult kids","Baptist","Democrat",,,,,,,,,,,,,,"Hospitals have whole departments dedicated to avoiding liability; When something goes wrong, they blame the nurse first; I've seen them change charts after bad outcomes; If you want to know the truth, ask the nurses; Administration cares about money, not patients",,,,"Will advocate for plaintiff from the start. Will push for maximum damages including punitives. Will frame case as justice issue, not just about this plaintiff. May clash with Bootstrappers.",,,,,,,,"STRONG PLAINTIFF","Corporations have too much power and routinely harm regular people. The legal system is one of few ways to hold them accountable. Large verdicts send a message and force change.","Skepticism of corporations, 'the system,' or 'big business'; Union membership or labor/activist background; Social work, nonprofit, education, or advocacy career; Progressive politics, college educated in social sciences; Phrases like 'accountability,' 'power imbalance,' 'pattern of behavior'",0.8,"High. Understands true impact of medical injuries.","Expert witness in jury room. Other jurors trust her medical knowledge.","KEEP. Especially in medical cases - she's your best weapon.","MUST STRIKE in medical cases. Her insider credibility is devastating.",1,5,,,,,,,,,,3,"Healthcare Professional(POSITIVE:0.80); Bachelor's Degree(POSITIVE:0.70); Age 31-50(POSITIVE:0.70)",true,2026-01-28T14:05:24.963Z,2026-01-29T16:46:29.473Z
0753b8ac-427e-44d8-a28e-cad39d26b27a,"NPR Nancy","NPR Nancy","Career in nonprofit sector working on consumer protection and environmental issues. Reads extensively about corporate behavior. Listens to NPR, reads The Atlantic, New Yorker. Believes in evidence-based policy and corporate accountability. Well-informed and articulate.","I've read the studies. Corporations systematically externalize costs onto the public.",CRUS_03,crusader,1,,,2,system,,"Educated liberal. Believes in regulation and accountability.",48,female,white,"Evanston, IL (suburban)","Master's - Public Policy","Nonprofit Program Director",85000,"Married, 2 kids","Unitarian","Democrat",,,,,,,,,,,,,,"The research shows corporations routinely cut corners; This is about accountability, not punishment; Regulations exist for a reason; The company made a calculated decision; We've seen this pattern across industries",,,,"Will advocate for plaintiff from the start. Will push for maximum damages including punitives. Will frame case as justice issue, not just about this plaintiff. May clash with Bootstrappers.",,,,,,,,"STRONG PLAINTIFF","Corporations have too much power and routinely harm regular people. The legal system is one of few ways to hold them accountable. Large verdicts send a message and force change.","Skepticism of corporations, 'the system,' or 'big business'; Union membership or labor/activist background; Social work, nonprofit, education, or advocacy career; Progressive politics, college educated in social sciences; Phrases like 'accountability,' 'power imbalance,' 'pattern of behavior'",0.8,"High, but evidence-based. Will want documentation.","Articulate advocate. Can translate systemic issues for other jurors.","KEEP. Smart advocate who can persuade moderates.","STRIKE. Too knowledgeable about corporate behavior.",1,5,,,,,,,,,,2,"Advanced Degree(POSITIVE:0.80); Age 31-50(POSITIVE:0.70)",true,2026-01-28T14:05:24.960Z,2026-01-29T16:46:29.471Z
19dcbe44-2ecc-4906-8964-0b129472d2a0,"Professor Progressive","Professor Progressive","Career documenting structural inequality and corporate impunity. Published extensively on how corporations avoid accountability. Most ideologically committed of all Crusaders. Has academic framework supporting every pro-plaintiff argument. May come across as lecturing.","Corporate impunity is well-documented in the academic literature.",,crusader,1,,,2,system,,"Academic theorist. Most ideologically committed but may seem out of touch.",56,female,Latina,"Austin, TX (urban)","PhD - Sociology","Professor of Sociology",125000,"Married, 1 adult child","Catholic (cultural)","Democrat (progressive)",,,,,,,,,,,,,,"The research is clear on this; This is a textbook example of corporate externalization of costs; Power structures protect their own; We see this pattern across industries; Individual responsibility rhetoric obscures systemic causation",,,,"Will advocate for plaintiff from the start. Will push for maximum damages including punitives. Will frame case as justice issue, not just about this plaintiff. May clash with Bootstrappers.",,,,,,,,"STRONG PLAINTIFF","Corporations have too much power and routinely harm regular people. The legal system is one of few ways to hold them accountable. Large verdicts send a message and force change.","Skepticism of corporations, 'the system,' or 'big business'; Union membership or labor/activist background; Social work, nonprofit, education, or advocacy career; Progressive politics, college educated in social sciences; Phrases like 'accountability,' 'power imbalance,' 'pattern of behavior'",0.9,"Maximum. Views case as proving her academic theories.","Will provide intellectual framework. May alienate some jurors.","KEEP with caution. Smart but may seem out of touch to working-class jurors.","CHALLENGE FOR CAUSE (pre-formed academic views) or STRIKE.",1,5,,,,,,,,,,2,"Education Professional(POSITIVE:0.80); Age 51+(POSITIVE:0.70)",true,2026-01-28T14:05:24.971Z,2026-01-28T16:18:28.433Z
0767c3c1-91ad-4ede-afc1-2bfe4de0750e,"Screwed-By-The-System Sam","Screwed-By-The-System Sam","Parents lost home in 2008 financial crisis. Started college but had to drop out due to costs. Works multiple gig jobs with no benefits or security. Carries student loans for degree he never finished. Authentic grievance against 'the system' - not academic theory but lived experience.","My parents lost their house in 2008. No banker went to jail. The system is rigged.",CRUS_07,crusader,1,,,2,system,,"Working-class populist. Personal grievance against corporate America.",29,male,white,"Boston, MA (urban)","Some college (didn't finish)","Bartender / Uber driver",38000,"Single, no kids","Catholic (lapsed)","Independent (populist)",,,,,,,,,,,,,,"The system is rigged; My parents played by the rules and lost everything; These companies never pay for what they do; Nobody at the top ever goes to jail; Must be nice to have lawyers on retainer",,,,"Will advocate for plaintiff from the start. Will push for maximum damages including punitives. Will frame case as justice issue, not just about this plaintiff. May clash with Bootstrappers.",,,,,,,,"STRONG PLAINTIFF","Corporations have too much power and routinely harm regular people. The legal system is one of few ways to hold them accountable. Large verdicts send a message and force change.","Skepticism of corporations, 'the system,' or 'big business'; Union membership or labor/activist background; Social work, nonprofit, education, or advocacy career; Progressive politics, college educated in social sciences; Phrases like 'accountability,' 'power imbalance,' 'pattern of behavior'",0.75,"High. Wants corporations to feel pain.","Emotional advocate. Less articulate but authentic.","KEEP. Authentic grievance resonates across political lines.","STRIKE. His anger will drive deliberations.",1,5,,,,,,,,,,1,"Age 18-30(POSITIVE:0.70)",true,2026-01-28T14:05:24.967Z,2026-01-29T16:46:29.476Z
2ec82edf-7b58-4af8-a745-b6aaaeb2fd10,"Seen-Both-Sides Steve","Seen-Both-Sides Steve","30 years in construction. Has seen contractors skip safety to save money - and seen workers exaggerate injuries for comp. More nuanced than academic Crusaders. Generally believes companies are at fault but won't automatically accept every plaintiff claim. Working-class credibility makes him influential.","I've seen companies cut corners AND workers exaggerate. But usually it's the company.",CRUS_09,crusader,1,,,2,system,,"Blue-collar realist. Pro-worker but not naive. More credible than academic types.",54,male,white,"Pittsburgh, PA (urban)","Trade school - Electrical","Union Electrician",85000,"Married, 2 adult kids","Catholic","Democrat",,,,,,,,,,,,,,"I've seen guys get hurt when companies cut corners; I've also seen guys milk injuries; You can usually tell who's being straight with you; In my experience on job sites...; Both sides can be full of it, but usually...",,,,"Will advocate for plaintiff from the start. Will push for maximum damages including punitives. Will frame case as justice issue, not just about this plaintiff. May clash with Bootstrappers.",,,,,,,,"STRONG PLAINTIFF","Corporations have too much power and routinely harm regular people. The legal system is one of few ways to hold them accountable. Large verdicts send a message and force change.","Skepticism of corporations, 'the system,' or 'big business'; Union membership or labor/activist background; Social work, nonprofit, education, or advocacy career; Progressive politics, college educated in social sciences; Phrases like 'accountability,' 'power imbalance,' 'pattern of behavior'",0.65,"Fair. Not extreme.","Voice of working-class reason. Can bridge Crusaders and moderates.","KEEP. He's a credible moderate who leans your way.","CONSIDER KEEPING if plaintiff's case is weak. He's not automatic plaintiff vote.",1,5,,,,,,,,,,1,"Age 51+(POSITIVE:0.70)",true,2026-01-28T14:05:24.970Z,2026-01-29T16:46:29.477Z
f6b526ab-86d4-40f7-a861-909970e6771d,"Tree-Hugger Tina","Tree-Hugger Tina","Works for state environmental agency investigating corporate violations. Daily job exposes her to companies lying about compliance, cutting corners, and calculating fines as cost of doing business. Environmental activist background. Sees corporate claims of 'safety culture' as PR fiction.","I work for the state EPA. I see corporate violations every day.",CRUS_06,crusader,1,,,2,system,,"Environmental regulator. Professional skeptic of corporate compliance claims.",31,female,South Asian,"Portland, OR (urban)","Master's - Environmental Science","Environmental Compliance Officer (State)",72000,"Single, no kids","Hindu (cultural)","Democrat (progressive)",,,,,,,,,,,,,,"I see corporate violations every day in my job; Companies calculate fines as cost of doing business; The documents always tell the real story; Compliance is just a checkbox for most companies; I know how to read these reports",,,,"Will advocate for plaintiff from the start. Will push for maximum damages including punitives. Will frame case as justice issue, not just about this plaintiff. May clash with Bootstrappers.",,,,,,,,"STRONG PLAINTIFF","Corporations have too much power and routinely harm regular people. The legal system is one of few ways to hold them accountable. Large verdicts send a message and force change.","Skepticism of corporations, 'the system,' or 'big business'; Union membership or labor/activist background; Social work, nonprofit, education, or advocacy career; Progressive politics, college educated in social sciences; Phrases like 'accountability,' 'power imbalance,' 'pattern of behavior'",0.9,"Maximum including punitives. Wants to change behavior.","Will analyze defendant's documents with professional skepticism.","KEEP. Her professional expertise supports your case.","CHALLENGE FOR CAUSE (her job is finding violations) or STRIKE.",1,5,,,,,,,,,,3,"First Responder(POSITIVE:0.80); Advanced Degree(POSITIVE:0.80); Age 31-50(POSITIVE:0.70)",true,2026-01-28T14:05:24.965Z,2026-01-29T16:46:29.474Z
e553e118-26b1-4cd4-bddf-f01468c5e889,"Union-Strong Ulysses","Union-Strong Ulysses","20+ years on the line and representing workers against management. Has personally witnessed safety violations, coverups, and retaliation. Seen coworkers injured while companies denied responsibility. His views come from lived experience, not academic theory - makes him very credible to other jurors.","I've seen what companies do to workers when no one's watching.",CRUS_02,crusader,1,,,2,system,,"Labor leader with decades of fighting corporate abuse. Credible and influential.",42,male,Black,"Detroit, MI (urban)","Some college - Labor studies","UAW Shop Steward",75000,"Married, 3 kids","Baptist","Democrat",,,,,,,,,,,,,,"I've been fighting for workers my whole career; Companies will say anything to avoid responsibility; I've seen this exact pattern before; When there's money on one side and a worker on the other...; They knew. They always know.",,,,"Will advocate for plaintiff from the start. Will push for maximum damages including punitives. Will frame case as justice issue, not just about this plaintiff. May clash with Bootstrappers.",,,,,,,,"STRONG PLAINTIFF","Corporations have too much power and routinely harm regular people. The legal system is one of few ways to hold them accountable. Large verdicts send a message and force change.","Skepticism of corporations, 'the system,' or 'big business'; Union membership or labor/activist background; Social work, nonprofit, education, or advocacy career; Progressive politics, college educated in social sciences; Phrases like 'accountability,' 'power imbalance,' 'pattern of behavior'",0.85,"High. Understands what injuries cost workers.","Influential voice. Working-class credibility resonates with moderates.","KEEP. Combines strong views with credibility and leadership.","MUST STRIKE. His lived experience will persuade other jurors.",1,5,,,,,,,,,,1,"Age 31-50(POSITIVE:0.70)",true,2026-01-28T14:05:24.958Z,2026-01-29T16:46:29.470Z
7d004638-1900-4be8-bc07-e067016a2a71,"Woke Wendy","Woke Wendy","MSW from Columbia focused on systemic poverty. Daily work exposes her to families harmed by corporations, landlords, employers. Politically active in progressive causes. Believes individual cases represent larger patterns of corporate abuse. NPR listener, reads New York Times.","The system is designed to protect the powerful at the expense of everyone else.",CRUS_01,crusader,1,,,2,system,,"Progressive activist. Sees corporations as inherently harmful.",34,female,white,"Brooklyn, NY (urban)","Master's - Social Work","Social Worker",58000,"Single, no kids","Jewish (secular)","Democrat (progressive wing)",,,,,,,,,,,,,,"We need to talk about the power imbalance here; Corporations care about profits, not people; This is exactly how the system fails regular people; Someone has to hold them accountable; This isn't just about this case - it's about sending a message",,,,"Will advocate for plaintiff from the start. Will push for maximum damages including punitives. Will frame case as justice issue, not just about this plaintiff. May clash with Bootstrappers.",,,,,,,,"STRONG PLAINTIFF","Corporations have too much power and routinely harm regular people. The legal system is one of few ways to hold them accountable. Large verdicts send a message and force change.","Skepticism of corporations, 'the system,' or 'big business'; Union membership or labor/activist background; Social work, nonprofit, education, or advocacy career; Progressive politics, college educated in social sciences; Phrases like 'accountability,' 'power imbalance,' 'pattern of behavior'",0.85,"Maximum. Will push for punitives to 'send a message.'","Vocal plaintiff advocate. Will frame case as systemic issue.","KEEP. Will fight for maximum verdict.","MUST STRIKE. She's already decided corporations are guilty.",1,5,,,,,,,,,,2,"Advanced Degree(POSITIVE:0.80); Age 31-50(POSITIVE:0.70)",true,2026-01-28T14:05:24.956Z,2026-01-29T16:46:29.468Z
5ac8d0c0-d896-4ab9-b86b-3d7ffbb5eb49,"Bleeding-Heart Betty","Bleeding-Heart Betty","Spent career caring for elderly and disabled. Deep well of empathy. Will project plaintiff's family onto her own. May literally cry during testimony. Emotional response overrides analytical thinking.","I just keep thinking about their poor family. How will they ever recover?",HEART_02,heart,1,,,2,system,,"Maximum empathy, minimum analysis. Will cry during testimony.",58,female,white,"Cincinnati, OH (suburban)","Some college","Home Health Aide",32000,"Married, 4 kids, 7 grandkids","Catholic (devout)","Democrat",,,,,,,,,,,,,,"Those poor people; I can't stop thinking about their family; Money can't fix this, but it's something; [Gets teary discussing injuries]; How can we put a price on suffering?",,,,"Will advocate for plaintiff from emotional connection. Will push for high non-economic damages. May become visibly emotional during deliberation. Will humanize plaintiff's story and resist cold calculation.",,,,,,,,"STRONG PLAINTIFF","This person has suffered. Their pain is real. They deserve compassion and compensation. Money can't fix everything, but it can help.","Helping profession (nursing, counseling, teaching, ministry); Emotional language and visible reactions to suffering; References to family, children, 'putting yourself in their shoes'; Strong religious faith emphasizing compassion; Phrases like 'I can only imagine' or 'think about their family'",0.8,"Maximum. Emotion drives numbers.","Emotional center. May sway other Hearts and undecideds.","KEEP. Your most reliable high-damages advocate.","MUST STRIKE. She decided with her heart before evidence started.",1,4,,,,,,,,,,1,"Age 51+(POSITIVE:0.70)",true,2026-01-28T14:05:25.004Z,2026-01-29T16:46:29.532Z
24803f02-dd5d-447a-aa99-d31cb4259e67,"Caregiver Carol","Caregiver Carol","Took early retirement to care for mother after stroke. Five years as full-time caregiver. Experienced exhaustion, financial strain, isolation, career sacrifice. Knows what families of seriously injured people actually go through - the part no one talks about.","I spent five years caring for my mother after her stroke. I know what families go through.",,heart,1,,,2,system,,"Personal caregiver experience. Knows the hidden costs of catastrophic injury.",58,female,white,"Cleveland, OH (suburban)","Bachelor's - Early Childhood Education","Retired Teacher / Former Full-Time Caregiver",35000,"Divorced, 2 adult kids","Lutheran","Democrat",,,,,,,,,,,,,,"I know what it's like to care for someone who's been hurt; People don't understand the toll on the whole family; The medical bills were devastating, but that's not even the half of it; I gave up my career, my friends, my life; Caregiving nearly broke me",,"{}","{}","Will advocate for plaintiff from emotional connection. Will push for high non-economic damages. May become visibly emotional during deliberation. Will humanize plaintiff's story and resist cold calculation.",FOLLOWER,"Empathetic and emotional. Connects through personal stories and feelings.","Moved by emotional appeals, personal stories, and empathy.",,,,,"STRONG PLAINTIFF","This person has suffered. Their pain is real. They deserve compassion and compensation. Money can't fix everything, but it can help.","Helping profession (nursing, counseling, teaching, ministry); Emotional language and visible reactions to suffering; References to family, children, 'putting yourself in their shoes'; Strong religious faith emphasizing compassion; Phrases like 'I can only imagine' or 'think about their family'",0.7,"High. Understands family impact costs that others miss.","Expert on hidden costs. Will educate jury about caregiving reality.","KEEP. Especially in catastrophic injury cases.","STRIKE in serious injury cases. She knows too much about real costs.",1,4,"{}","{}","{""nickname"":""Caregiver Carol"",""archetype"":""HEART"",""persona_id"":""HEART_8.5_CaregiverCarol"",""experience_lens"":{""caregiver_identification"":""0.9"",""family_impact_sensitivity"":0.9,""life_care_plan_appreciation"":""0.85""},""damage_multiplier"":""1.6"",""archetype_strength"":""0.85"",""liability_threshold"":""0.35""}","{}","{}","{}","[]","{}","[]",3,"Education Professional(POSITIVE:0.80); Bachelor's Degree(POSITIVE:0.70); Age 51+(POSITIVE:0.70)",true,2026-01-23T13:05:55.376Z,2026-01-28T16:18:28.503Z
